{
  "id": "repository",
  "template": ".lof/templates/backend/repository.py.j2",
  "targetType": "python-module",
  "outputPattern": "generated-project/apps/api/src/app/modules/{{ id }}/repository.py",
  "parameters": {
    "name": {
      "type": "string",
      "required": true
    },
    "fields": {
      "type": "array"
    }
  }
}