{
  "$schema": "../../../schemas/type.schema.json",
  "id": "database-config",
  "description": "Database configuration",
  "parameters": {
    "databaseUrl": { "type": "string", "default": "sqlite+aiosqlite:///./app.db" },
    "echo": { "type": "boolean", "default": false }
  },
  "template": "templates/backend/database.py.j2",
  "targetType": "python-module",
  "outputPattern": "generated-project/apps/api/src/app/database.py"
}
