{
  "id": "service",
  "template": ".lof/templates/backend/service.py.j2",
  "targetType": "python-module",
  "outputPattern": "generated-project/apps/api/src/app/modules/{{ id }}/service.py",
  "parameters": {
    "name": {
      "type": "string",
      "required": true
    },
    "fields": {
      "type": "array"
    }
  }
}