{
  "id": "type",
  "template": ".lof/templates/frontend/types.ts.j2",
  "targetType": "typescript-module",
  "outputPattern": "generated-project/apps/web/src/types/{{ id }}.ts",
  "parameters": {
    "name": {
      "type": "string",
      "required": true
    },
    "fields": {
      "type": "array"
    }
  }
}