{
  "id": "api-test",
  "template": ".lof/templates/backend/test_entity.py.j2",
  "targetType": "python-module",
  "outputPattern": "generated-project/apps/api/tests/modules/test_{{ name | snake_case }}.py",
  "parameters": {
    "name": {
      "type": "string",
      "required": true
    },
    "fields": {
      "type": "array"
    }
  }
}