{
  "id": "app-components-json",
  "template": ".lof/templates/frontend/components.json.j2",
  "targetType": "typescript-module",
  "outputPattern": "generated-project/apps/web/components.json",
  "parameters": {
    "name": {
      "type": "string",
      "required": true
    },
    "fields": {
      "type": "array"
    }
  }
}