{
  "id": "employee",
  "description": "Employee profile",
  "template": "templates/mobile/data/entity.ts.j2",
  "outputPattern": "generated/typescript/{{ instance_id }}.ts",
  "parameters": {
    "firstName": {"type": "string", "required": true},
    "lastName": {"type": "string", "required": true},
    "role": {"type": "string"},
    "team": {"type": "string"},
    "phone": {"type": "string"},
    "vehicle": {"type": "string"},
    "certifications": {"type": "array"}
  },
  "targetType": "expo-service"
}
