{
  "$schema": "../../../schemas/type.schema.json",
  "id": "web-vite-config",
  "description": "Vite configuration for the frontend",
  "parameters": {
    "title": { "type": "string", "default": "Application" }
  },
  "template": "templates/frontend/vite.config.ts.j2",
  "targetType": "typescript-module",
  "outputPattern": "generated-project/apps/web/vite.config.ts"
}
