{
  "$schema": "../../../schemas/type.schema.json",
  "id": "react-app",
  "description": "React application bootstrap with routes and navigation",
  "parameters": {
    "title": { "type": "string", "default": "Application" },
    "modules": { "type": "array", "required": true }
  },
  "template": "templates/frontend/App.tsx.j2",
  "targetType": "react-component",
  "outputPattern": "generated-project/apps/web/src/App.tsx"
}
