{
  "id": "app-ui-badge",
  "template": ".lof/templates/frontend/src/components/ui/badge.tsx.j2",
  "targetType": "react-component",
  "outputPattern": "generated-project/apps/web/src/components/ui/badge.tsx",
  "parameters": {
    "name": {
      "type": "string",
      "required": true
    },
    "fields": {
      "type": "array"
    }
  }
}